{
  "name": "Focus Flow",
  "description": "Energy for creative sprints, remote-friendly.",
  "source_service": "spotify",
  "source_playlist_id": "abc123",
  "tracks": [
    {
      "position": 1,
      "title": "Analog \"Sunset\"",
      "artists": ["Neon Echoes", "Cityline"],
      "album": "Signals, Vol. 2",
      "duration_ms": 200500,
      "explicit": false,
      "release_date": "2023-03-01",
      "isrc": "US-ABC-23-00002",
      "mb_recording_id": null,
      "mb_release_id": null,
      "provider_ids": {
        "spotify_track_id": "spotify123",
        "youtube_video_id": "yt123456"
      }
    },
    {
      "position": 2,
      "title": "Orbital Drift",
      "artists": ["Lofi Dreams"],
      "album": null,
      "duration_ms": null,
      "explicit": null,
      "release_date": null,
      "isrc": null,
      "mb_recording_id": null,
      "mb_release_id": null,
      "provider_ids": {
        "tidal_track_id": "tidal987"
      }
    }
  ]
}
